{
  "schema_version": "1flowbase.model-pricing-page/v2",
  "catalog_version": "2026-10-31.3",
  "currency_code": "USD",
  "page": 61,
  "cursor": "YWZ0ZXI6MTBmODlkMmQtOGM5NC00Y2EzLWJlNDQtM2Q4M2YyMmYyNjFi",
  "next_cursor": "YWZ0ZXI6OGZjZmNkNTktMTY0ZC00NmE1LWE4ODMtZGZkNzgzNjIyNDRm",
  "next_page_locator": "https://raw.githubusercontent.com/taichuy/1flowbase-official-plugins/main/model-pricing/catalog/v1/pages/62.json",
  "rules": [
    {
      "provider_code": "kenari",
      "upstream_model_id": "claude-opus-4-8",
      "currency_code": "USD",
      "effective_to": null,
      "timezone": "UTC",
      "weekday_mask": 127,
      "local_time_start": null,
      "local_time_end": null,
      "priority": 0,
      "enabled": true,
      "input_token_unit_size": 1000000,
      "input_token_unit_price": "5.71428571",
      "output_token_unit_size": 1000000,
      "output_token_unit_price": "29.71428571",
      "cache_hit_token_unit_size": 1000000,
      "cache_hit_token_unit_price": "0.57142857",
      "cache_write_token_unit_size": 1000000,
      "cache_write_token_unit_price": "7.42857143",
      "id": "74506e3b-8794-4782-9dc6-2b071cfa3efa",
      "effective_from": "2026-10-31T02:01:38.612Z",
      "rules": [],
      "extensions": {
        "source": "community_pricing",
        "price_sync": {
          "synced_at": "2026-10-31T02:01:38.612Z",
          "meters": {
            "input": {
              "source": "models.dev",
              "provider": "kenari",
              "model": "claude-opus-4-8",
              "field": "cost.input",
              "url": "https://models.dev/api.json"
            },
            "output": {
              "source": "models.dev",
              "provider": "kenari",
              "model": "claude-opus-4-8",
              "field": "cost.output",
              "url": "https://models.dev/api.json"
            },
            "cache_hit": {
              "source": "models.dev",
              "provider": "kenari",
              "model": "claude-opus-4-8",
              "field": "cost.cache_read",
              "url": "https://models.dev/api.json"
            },
            "cache_write": {
              "source": "models.dev",
              "provider": "kenari",
              "model": "claude-opus-4-8",
              "field": "cost.cache_write",
              "url": "https://models.dev/api.json"
            }
          },
          "rules": []
        }
      },
      "source_kind": "official",
      "source_catalog_id": "74506e3b-8794-4782-9dc6-2b071cfa3efa",
      "source_checksum": "sha256:f090b60ff44cc2a2a0990a3f8917d990b3e540a4b3056575467ee85473b2218a",
      "source_version": "2026-10-31.3"
    },
    {
      "provider_code": "kenari",
      "upstream_model_id": "claude-opus-5",
      "currency_code": "USD",
      "effective_to": null,
      "timezone": "UTC",
      "weekday_mask": 127,
      "local_time_start": null,
      "local_time_end": null,
      "priority": 0,
      "enabled": true,
      "input_token_unit_size": 1000000,
      "input_token_unit_price": "5.71428571",
      "output_token_unit_size": 1000000,
      "output_token_unit_price": "28.57142857",
      "cache_hit_token_unit_size": 1000000,
      "cache_hit_token_unit_price": "2.28571429",
      "cache_write_token_unit_size": 1000000,
      "cache_write_token_unit_price": "5.71428571",
      "id": "ac959b56-e44a-4fa7-917a-5562018e4915",
      "effective_from": "2026-10-31T02:01:38.612Z",
      "rules": [],
      "extensions": {
        "source": "community_pricing",
        "price_sync": {
          "synced_at": "2026-10-31T02:01:38.612Z",
          "meters": {
            "input": {
              "source": "models.dev",
              "provider": "kenari",
              "model": "claude-opus-5",
              "field": "cost.input",
              "url": "https://models.dev/api.json"
            },
            "output": {
              "source": "models.dev",
              "provider": "kenari",
              "model": "claude-opus-5",
              "field": "cost.output",
              "url": "https://models.dev/api.json"
            },
            "cache_hit": {
              "source": "models.dev",
              "provider": "kenari",
              "model": "claude-opus-5",
              "field": "cost.cache_read",
              "url": "https://models.dev/api.json"
            },
            "cache_write": {
              "source": "models.dev",
              "provider": "kenari",
              "model": "claude-opus-5",
              "field": "cost.cache_write",
              "url": "https://models.dev/api.json"
            }
          },
          "rules": []
        }
      },
      "source_kind": "official",
      "source_catalog_id": "ac959b56-e44a-4fa7-917a-5562018e4915",
      "source_checksum": "sha256:5332461122045207cd91ce3599724df0b8d2a92f22c7c0b309ae44ee0458915f",
      "source_version": "2026-10-31.3"
    },
    {
      "provider_code": "kenari",
      "upstream_model_id": "claude-sonnet-4-6",
      "currency_code": "USD",
      "effective_to": null,
      "timezone": "UTC",
      "weekday_mask": 127,
      "local_time_start": null,
      "local_time_end": null,
      "priority": 0,
      "enabled": true,
      "input_token_unit_size": 1000000,
      "input_token_unit_price": "3.6",
      "output_token_unit_size": 1000000,
      "output_token_unit_price": "17.71428571",
      "cache_hit_token_unit_size": 1000000,
      "cache_hit_token_unit_price": "0.36",
      "cache_write_token_unit_size": 1000000,
      "cache_write_token_unit_price": "4.45714286",
      "id": "6e362636-41a4-4ff7-a3a4-3618d93a8517",
      "effective_from": "2026-10-31T02:01:38.612Z",
      "rules": [],
      "extensions": {
        "source": "community_pricing",
        "price_sync": {
          "synced_at": "2026-10-31T02:01:38.612Z",
          "meters": {
            "input": {
              "source": "models.dev",
              "provider": "kenari",
              "model": "claude-sonnet-4-6",
              "field": "cost.input",
              "url": "https://models.dev/api.json"
            },
            "output": {
              "source": "models.dev",
              "provider": "kenari",
              "model": "claude-sonnet-4-6",
              "field": "cost.output",
              "url": "https://models.dev/api.json"
            },
            "cache_hit": {
              "source": "models.dev",
              "provider": "kenari",
              "model": "claude-sonnet-4-6",
              "field": "cost.cache_read",
              "url": "https://models.dev/api.json"
            },
            "cache_write": {
              "source": "models.dev",
              "provider": "kenari",
              "model": "claude-sonnet-4-6",
              "field": "cost.cache_write",
              "url": "https://models.dev/api.json"
            }
          },
          "rules": []
        }
      },
      "source_kind": "official",
      "source_catalog_id": "6e362636-41a4-4ff7-a3a4-3618d93a8517",
      "source_checksum": "sha256:29f6116dc5d83356b1d4dee68e3225b23bb569569fada500b63211275359d465",
      "source_version": "2026-10-31.3"
    },
    {
      "provider_code": "kenari",
      "upstream_model_id": "claude-sonnet-5",
      "currency_code": "USD",
      "effective_to": null,
      "timezone": "UTC",
      "weekday_mask": 127,
      "local_time_start": null,
      "local_time_end": null,
      "priority": 0,
      "enabled": true,
      "input_token_unit_size": 1000000,
      "input_token_unit_price": "1.42857143",
      "output_token_unit_size": 1000000,
      "output_token_unit_price": "7.14285714",
      "cache_hit_token_unit_size": 1000000,
      "cache_hit_token_unit_price": "0.57142857",
      "cache_write_token_unit_size": 1000000,
      "cache_write_token_unit_price": "1.71428571",
      "id": "26715e45-245f-49a1-b3a6-3212a68003cb",
      "effective_from": "2026-10-31T02:01:38.612Z",
      "rules": [],
      "extensions": {
        "source": "community_pricing",
        "price_sync": {
          "synced_at": "2026-10-31T02:01:38.612Z",
          "meters": {
            "input": {
              "source": "models.dev",
              "provider": "kenari",
              "model": "claude-sonnet-5",
              "field": "cost.input",
              "url": "https://models.dev/api.json"
            },
            "output": {
              "source": "models.dev",
              "provider": "kenari",
              "model": "claude-sonnet-5",
              "field": "cost.output",
              "url": "https://models.dev/api.json"
            },
            "cache_hit": {
              "source": "models.dev",
              "provider": "kenari",
              "model": "claude-sonnet-5",
              "field": "cost.cache_read",
              "url": "https://models.dev/api.json"
            },
            "cache_write": {
              "source": "models.dev",
              "provider": "kenari",
              "model": "claude-sonnet-5",
              "field": "cost.cache_write",
              "url": "https://models.dev/api.json"
            }
          },
          "rules": []
        }
      },
      "source_kind": "official",
      "source_catalog_id": "26715e45-245f-49a1-b3a6-3212a68003cb",
      "source_checksum": "sha256:a8af539d6d4fabd13a76c1449d4688e1bf8d70b4cfb98ec91934011bbcff425d",
      "source_version": "2026-10-31.3"
    },
    {
      "provider_code": "kenari",
      "upstream_model_id": "gemini-3-1-flash-lite",
      "currency_code": "USD",
      "effective_to": null,
      "timezone": "UTC",
      "weekday_mask": 127,
      "local_time_start": null,
      "local_time_end": null,
      "priority": 0,
      "enabled": true,
      "input_token_unit_size": 1000000,
      "input_token_unit_price": "0.28571429",
      "output_token_unit_size": 1000000,
      "output_token_unit_price": "1.71428571",
      "cache_hit_token_unit_size": 1000000,
      "cache_hit_token_unit_price": "0.02857143",
      "cache_write_token_unit_size": 1000000,